{"artifact_id":"dm:identity:v1:rUn8viYkKSIqWl9HnitIApBqMX8ubk6C8MxBoW-APao","body":{"being_ref":"dm:being:v1:VlG-k1yMoEXlpk0GvxVCALmpTlFp7GizcHzt3hPcQQs","control_generation":0,"control_sequence":1,"previous_control_head":"dm:identity:v1:Nca5Hlx-dWYGgzJap1H82V4VJTwKDbGOufJ0_-8-Lys","replacement_recovery":{"keys":[{"algorithm":"Ed25519","key_id":"dm:key:v1:Tu3DWxIlSl3c_iNggcuopRLkRpmBIdxe__iL_TcjCYk","public":"Bayqj7XYqnq96u1cf4gfSc020kwRfFTOeilQJNzhV34"},{"algorithm":"Ed25519","key_id":"dm:key:v1:ekMhvE_Pc6jpYpuuloIimuV1oFJg8wFJmseMWvcptaE","public":"c_-s3ioXNsS69rwbqup4hRQzdchgIIJFJoitCZ-zubQ"}],"threshold":2}},"kind":"recovery-policy","schema":"dm.identity.artifact/v1","signatures":[{"algorithm":"Ed25519","key_id":"dm:key:v1:2BAnM77TgiYBJBEJFH3VMvOR4xaNgBdt-QfNVdp2sxg","role":"recovery-authorization","value":"7WNnd7XWxnVmm73VTtoKRDh7BjW7yUsnlgzraFMugJ89PYJtEOnYsosTJtMNEdCG_wHZ0zLNee5bbJ2eGsW5Bg"},{"algorithm":"Ed25519","key_id":"dm:key:v1:2Fx4ruZiQQawDMeLxJtMPPgIu-z2im08AmtHM9jDEIo","role":"root-authorization","value":"lfnERQXQiiVNn0nXGxuWSzEyjsx45ZU0t6JPPWCOtMsa4txPOvLA4VL62Y2zK4KNanUVBvNZLFy0U7rID7hLBw"},{"algorithm":"Ed25519","key_id":"dm:key:v1:LG5PTtt3Uc0syqP86SwpU_sQ6t6XbLqzBERV0dyiyWU","role":"recovery-authorization","value":"zRXLBZ52URHQWVjf1_Yl_Yd4jyWq4K3cVt1u5Nh0Mzhe9K-ybygEE_Wm8Kzxzo_QPhjxl38ftauw-xPRQsUVDw"},{"algorithm":"Ed25519","key_id":"dm:key:v1:Tu3DWxIlSl3c_iNggcuopRLkRpmBIdxe__iL_TcjCYk","role":"new-recovery-possession","value":"n0GttfuHvFmX3N1_u6gCutQ73MoqjcgGkhY-qqHTDV1w0g-MZUWYm2siVSmRNUNdUQ08aWPg6PYq6zwq9bkbDQ"},{"algorithm":"Ed25519","key_id":"dm:key:v1:cQhpr9D-av61wTjSZYxTRAij46l3w17pyEOvsmumozc","role":"recovery-authorization","value":"BAoKkh1MSUx-dctAcG-AtsjVFvX3g1fOyx0o5i2y2AlXmOD5TeioZ6Gb4B8CmiEpWj5k1bF98cNJmDWLfRChBQ"},{"algorithm":"Ed25519","key_id":"dm:key:v1:ekMhvE_Pc6jpYpuuloIimuV1oFJg8wFJmseMWvcptaE","role":"new-recovery-possession","value":"m4FvJRAnrwhpto2pt9zLFs1wM-OLCEx9yIUl4k1oVbYGVwEkUZJEH52VQSF8E_ZO1wdscVzTJoUBc7_qlzZfDQ"},{"algorithm":"Ed25519","key_id":"dm:key:v1:r_yqlYEigkMIL_vta_WIeDk-RPW-W2_77UMO7dRoVL4","role":"root-authorization","value":"vQ9K_8h_hTbb-fZQJMiADlTrBLqwBtF7pY3s0wNa99KZthElhu6USGl2TqQy5HfbwYkzytAyK_bi8cRCgH-EBA"},{"algorithm":"Ed25519","key_id":"dm:key:v1:zq6BNx7SnY3fYG_z8vq_F0LA-t_oqS14k-7fpd7I2FM","role":"root-authorization","value":"DjFwsgVzCKCrRKAWfWweR0aV6LT8XsQ3_mm-fPb0FXfj-Gc62nB12RFWwMoS0Qm3OVu7f9eF3SuQLEXKQlaNDA"}]}
