{"artifact_id":"dm:identity:v1:GdyBTV-EVnONkpitZMhqxUfj6O7jCrjwdihZ4uX673I","body":{"being_ref":"dm:being:v1:VlG-k1yMoEXlpk0GvxVCALmpTlFp7GizcHzt3hPcQQs","carry_forward_credentials":["dm:identity:v1:PWGfpIKl4W35tjo7YIzACT4Wnpb49ydFlqdUHs1h8wk"],"control_generation":0,"control_sequence":1,"previous_control_head":"dm:identity:v1:Nca5Hlx-dWYGgzJap1H82V4VJTwKDbGOufJ0_-8-Lys","replacement_root":{"keys":[{"algorithm":"Ed25519","key_id":"dm:key:v1:S-gSenGh8S9tq25kcX7qWgoeLUvXAyeE4Y9Gr_n_I8w","public":"6lLrJ9lfgGGZpzt4E7C0ErG7aBVABG0qk5ShMNnwBqs"},{"algorithm":"Ed25519","key_id":"dm:key:v1:_Dpd3-7NMOqru5Fql3CTRPhlUxAUDizvn47RDRuoa8s","public":"vo4bRLJAA9Re7EAUhWVDLKCppi4F38NlPhrZVOAEHNY"}],"threshold":2}},"kind":"root-rotation","schema":"dm.identity.artifact/v1","signatures":[{"algorithm":"Ed25519","key_id":"dm:key:v1:2Fx4ruZiQQawDMeLxJtMPPgIu-z2im08AmtHM9jDEIo","role":"root-authorization","value":"B9YvXGZ-blZ59DiOYkh8PRfSWvwCCjy76GmvDc1dMRbmYf0HD163EhM5DAvhbubWYt0isTgw6PeeQcNg7yMRDQ"},{"algorithm":"Ed25519","key_id":"dm:key:v1:S-gSenGh8S9tq25kcX7qWgoeLUvXAyeE4Y9Gr_n_I8w","role":"new-root-possession","value":"ji4LpEioo8sniDpLuKWd8M2U9k0dRuLc6-CixGRE_i9cs9mEdKZUuOF3Op-xLBEKEiBNY3JVM3cJwVZ6dqJ2AA"},{"algorithm":"Ed25519","key_id":"dm:key:v1:_Dpd3-7NMOqru5Fql3CTRPhlUxAUDizvn47RDRuoa8s","role":"new-root-possession","value":"9kVEX2yKjCdTrZ_H2VrFSVkQ6-1XKwENK5sa7bBBpdl6B7uCCJ2-7-giP2zpw2EXAESbhrTJLRuh6IpGXNs9Cg"},{"algorithm":"Ed25519","key_id":"dm:key:v1:r_yqlYEigkMIL_vta_WIeDk-RPW-W2_77UMO7dRoVL4","role":"root-authorization","value":"7ubRTFgRpFyUbhPoKB_-f9wS9FC3ZntAWArQa3rr8DGknm3ncD6xzzojF7tne6gXXYE65fnqfVaa_8bZWiR8BQ"},{"algorithm":"Ed25519","key_id":"dm:key:v1:zq6BNx7SnY3fYG_z8vq_F0LA-t_oqS14k-7fpd7I2FM","role":"root-authorization","value":"_lNA805mkOTzDr0nKU9MRbk5yCAxkhEGCVSksjcTfKbbSP2XF07MP3-hRWEf6inBzgXAZsaSfXL84vUGiMMEBA"}]}
