{"artifact_id":"dm:identity:v1:TLUD14jYDxVuCWtcH71M3vbC3moGw-oDXJV9dTmC_rU","body":{"being_ref":"dm:being:v1:VlG-k1yMoEXlpk0GvxVCALmpTlFp7GizcHzt3hPcQQs","carry_forward_credentials":[],"control_generation":0,"control_sequence":1,"previous_control_head":"dm:identity:v1:Nca5Hlx-dWYGgzJap1H82V4VJTwKDbGOufJ0_-8-Lys","replacement_root":{"keys":[{"algorithm":"Ed25519","key_id":"dm:key:v1:SEdVP3dewHVFsb3xzsnExuFNtzEE0fecJ-Ty8y2EwmE","public":"Wr0xFkr4yJcJHFlzk0l1BWTMqX-WNWHw3XH2TeusoNI"},{"algorithm":"Ed25519","key_id":"dm:key:v1:YjkBx87-ZXGV5Whpna6QuF-I_Pirz4jO6jqNDOCwREM","public":"j4OXQZ84ZIKKZQEJgxBWxl6YlMrJee1RFKRZakAiII4"}],"threshold":2}},"kind":"root-rotation","schema":"dm.identity.artifact/v1","signatures":[{"algorithm":"Ed25519","key_id":"dm:key:v1:2Fx4ruZiQQawDMeLxJtMPPgIu-z2im08AmtHM9jDEIo","role":"root-authorization","value":"cQ7m6D-6_VyhKtsSMYHxv2AUyD-CkkWuu4SWXGHUPluia2AXkhF2DIWvugOZ1GL2EBy5vFaWIupDWfdvdd9VDA"},{"algorithm":"Ed25519","key_id":"dm:key:v1:SEdVP3dewHVFsb3xzsnExuFNtzEE0fecJ-Ty8y2EwmE","role":"new-root-possession","value":"0NWIc8CLrTxog7a4SsOQfDBDVDNXbfOUHx2y7H8vXNh293E9tnO1i7MVHmVGeazlNEuMkA2_b3F1ac-3zd2ICw"},{"algorithm":"Ed25519","key_id":"dm:key:v1:YjkBx87-ZXGV5Whpna6QuF-I_Pirz4jO6jqNDOCwREM","role":"new-root-possession","value":"Dd6U9Q2zviejFp30J4BJ9b4ksfWq4RhZoWnzKUlLAlDEyjHJMWdKtSq7_2dCEz5dJWR2e3BOD_o-08sOi7lJBg"},{"algorithm":"Ed25519","key_id":"dm:key:v1:r_yqlYEigkMIL_vta_WIeDk-RPW-W2_77UMO7dRoVL4","role":"root-authorization","value":"EElOuDSlx_Jxhi1bi2O3w5hTIFGssl4BStIhhJzid05vj7qPEEudMa374RucPExHC3HW0qezfTLjkKxjGkMFCA"},{"algorithm":"Ed25519","key_id":"dm:key:v1:zq6BNx7SnY3fYG_z8vq_F0LA-t_oqS14k-7fpd7I2FM","role":"root-authorization","value":"5efXWnmtSfxG8s7u7awc1JKZ01YUR3NKoedKpaTkX7g0JHBYsIzEBR0HalXSPAuOG4qQdcAuzoUViUw_gbaWCw"}]}
