{"artifact_id":"dm:identity:v1:PWGfpIKl4W35tjo7YIzACT4Wnpb49ydFlqdUHs1h8wk","body":{"being_ref":"dm:being:v1:VlG-k1yMoEXlpk0GvxVCALmpTlFp7GizcHzt3hPcQQs","body_ref":"cluster:legion:compaii","control_head":"dm:identity:v1:Nca5Hlx-dWYGgzJap1H82V4VJTwKDbGOufJ0_-8-Lys","embodiment_id":"embodiment:vector:legion","encryption_key":{"algorithm":"X25519","key_id":"dm:key:v1:3k8sqStMpDF4rnM4WBzoUKOO5bs8vjAFze-yM6a2l4k","public":"C0XlnF-ZQ5OHJSz28ix1VxcgyOPPX-FlJ-4cLVWzSw4"},"purposes":["dm.we","messages"],"revocation_generation":0,"signing_key":{"algorithm":"Ed25519","key_id":"dm:key:v1:WyaJzQtEwQQzExL07i7r0OOAzb3jcq9ZiXVmZgBs6uI","public":"pAtP_JbGek59knE08Ml0qh4i47AmIUCxnYp7KbRPRz0"},"transport_principals":[{"key":{"algorithm":"Ed25519","key_id":"dm:key:v1:oyUEaRxSndYjtlYK8IkXBIsoY2yqvMkUenzPpOlKdeY","public":"z3N-q8IS6dMHyeYooW5Oz71K4OfcMc8sAqHyazyHICw"},"principal_id":"compaii@legion","scheme":"tribe-v1"}],"valid_from_ms":1799999999999,"valid_until_ms":1800086400000},"kind":"embodiment-credential","schema":"dm.identity.artifact/v1","signatures":[{"algorithm":"Ed25519","key_id":"dm:key:v1:2Fx4ruZiQQawDMeLxJtMPPgIu-z2im08AmtHM9jDEIo","role":"root-authorization","value":"JD0Y9T4zoAeG8xPagN9tr5qf7bfeOGWn7j8a9g2r7Dgzf__STFccG4UE0RvqrcbNCO4-3eenaP-NthL-w_XRBw"},{"algorithm":"Ed25519","key_id":"dm:key:v1:WyaJzQtEwQQzExL07i7r0OOAzb3jcq9ZiXVmZgBs6uI","role":"embodiment-acceptance","value":"n7cvBB57Strzck5BQBIr0fhL92v8IDJMF2LI-GxgBMM2G2k_MdJ5V-MWhLbCjV5P0Yq0Z8fe9CINRsqUWFQfAA"},{"algorithm":"Ed25519","key_id":"dm:key:v1:r_yqlYEigkMIL_vta_WIeDk-RPW-W2_77UMO7dRoVL4","role":"root-authorization","value":"twwdOicDBjR6XOXWMXSTLxnPw1TVEtS9kwkJkc0oaV4HhzDqcAJxlGt65TJlK0a0GcoMyUUv9L06_xag8DTuBQ"},{"algorithm":"Ed25519","key_id":"dm:key:v1:zq6BNx7SnY3fYG_z8vq_F0LA-t_oqS14k-7fpd7I2FM","role":"root-authorization","value":"ZDDuSpTpbpKnMmlGwBrsLOlAGcmNnr0239DoKz5YDgWnHhWEQRQlIM4zyd1__Al5RQnK1Qej834buqstgtT_Cw"}]}
