{"artifact_id":"dm:identity:v1:MHo_x7zmA1U-dnLB6fi8oqe208bzwV_HqxiPr1fbiw0","body":{"accepted_heads":[{"content_hash":"13ea36a184ccea94be754bc9ef628a2fc40d9c8f9d692564a5f77004a4906f73","event_id":"00000000-0000-4000-8000-000000000101","incarnation_id":"incarnation:00000000-0000-4000-8000-000000000011","origin_embodiment_id":"embodiment:00000000-0000-4000-8000-000000000001","sequence":1,"signer_key_id":"compaii@legion/sig/1"}],"being_ref":"dm:being:v1:VlG-k1yMoEXlpk0GvxVCALmpTlFp7GizcHzt3hPcQQs","control_head":"dm:identity:v1:Nca5Hlx-dWYGgzJap1H82V4VJTwKDbGOufJ0_-8-Lys","manifest_hash":"EMMjs9Dr4k9wuhDgOrc3TpE1pELwqPMozqQSmdTthN4","manifest_revision":1,"provisional_being_ref":"being:00000000-0000-4000-8000-000000000001"},"kind":"history-binding","schema":"dm.identity.artifact/v1","signatures":[{"algorithm":"Ed25519","key_id":"dm:key:v1:2Fx4ruZiQQawDMeLxJtMPPgIu-z2im08AmtHM9jDEIo","role":"root-authorization","value":"QaOnAzGs1SMgNBafRrKEL2wH_rtLzL7uzvJwoliiB7DGYIzVCEr2FmJ814-h0rxBbFTw9EfnLF_Blq8RUuEdAQ"},{"algorithm":"Ed25519","key_id":"dm:key:v1:r_yqlYEigkMIL_vta_WIeDk-RPW-W2_77UMO7dRoVL4","role":"root-authorization","value":"lr6JsSfmDaK9Tq-SoBFZ4NlLumpKXifTYGSAb6gKPnrNPlNzL0P_pvwAEsdF-HzlqC3mE6WEHTl4_K3kwUe8BA"},{"algorithm":"Ed25519","key_id":"dm:key:v1:zq6BNx7SnY3fYG_z8vq_F0LA-t_oqS14k-7fpd7I2FM","role":"root-authorization","value":"ksyidv4E0d1RpZMx-7gOUHyb1n5z-BgGaDiH29ZmHpNsioyfNWU5bs50ktMctXqcvxPPXVS2OAn2BIK27kQgBg"}]}
