{"artifact_id":"dm:identity:v1:Nca5Hlx-dWYGgzJap1H82V4VJTwKDbGOufJ0_-8-Lys","body":{"being_ref":"dm:being:v1:VlG-k1yMoEXlpk0GvxVCALmpTlFp7GizcHzt3hPcQQs","control_generation":0,"control_sequence":0,"core":{"nonce":"7ezsjkcd-yj9oSmFQjNayOXOgzSVr-VQm-jl8dkwDG8","protocol":"daimon-matrix","recovery":{"keys":[{"algorithm":"Ed25519","key_id":"dm:key:v1:2BAnM77TgiYBJBEJFH3VMvOR4xaNgBdt-QfNVdp2sxg","public":"X_hGYG7c7j4j8dQ9YUZ9quBAzP1ggS1WE6YrGgpbVqc"},{"algorithm":"Ed25519","key_id":"dm:key:v1:LG5PTtt3Uc0syqP86SwpU_sQ6t6XbLqzBERV0dyiyWU","public":"gWhBA7gYTXHnkZucjbvO8elxj4F_hMNTfYGdmC-SbdY"},{"algorithm":"Ed25519","key_id":"dm:key:v1:cQhpr9D-av61wTjSZYxTRAij46l3w17pyEOvsmumozc","public":"X4JQAvD1DeS7bJyOxTFDv9RPH0d2kzV8OY-UAlFZ3WE"}],"threshold":2},"root":{"keys":[{"algorithm":"Ed25519","key_id":"dm:key:v1:2Fx4ruZiQQawDMeLxJtMPPgIu-z2im08AmtHM9jDEIo","public":"AL7XGUGQo7DlZaKbpXJmcgUhgGMQz8elPwvkBW0-m-E"},{"algorithm":"Ed25519","key_id":"dm:key:v1:r_yqlYEigkMIL_vta_WIeDk-RPW-W2_77UMO7dRoVL4","public":"oq9g23sA_QfEtcuyudHgjrP3uN1UQrhp0DAVWi7cmJk"},{"algorithm":"Ed25519","key_id":"dm:key:v1:zq6BNx7SnY3fYG_z8vq_F0LA-t_oqS14k-7fpd7I2FM","public":"cM8C4qCUvd8LqGUj875c5CjMTNLl4y9ciaAX1fUX7ck"}],"threshold":2},"version":1},"created_at_ms":1800000000000},"kind":"genesis","schema":"dm.identity.artifact/v1","signatures":[{"algorithm":"Ed25519","key_id":"dm:key:v1:2BAnM77TgiYBJBEJFH3VMvOR4xaNgBdt-QfNVdp2sxg","role":"recovery-possession","value":"H_5Z8uHpe-IWHFwYad1bkdUd40iYESRet9vjXo6ZK7ErHzjl5UXpdCl4IXNnzya6uZYrr1jdHLbTMEufAdL2DQ"},{"algorithm":"Ed25519","key_id":"dm:key:v1:2Fx4ruZiQQawDMeLxJtMPPgIu-z2im08AmtHM9jDEIo","role":"root-authorization","value":"wjoqj38UTNBCWjCeIIPbo7JscSRfw8MnBFPWSMU9g98sZdu3RloQ18Hp809diApUd9WgnzoVVnkpUZCWN7MLAg"},{"algorithm":"Ed25519","key_id":"dm:key:v1:LG5PTtt3Uc0syqP86SwpU_sQ6t6XbLqzBERV0dyiyWU","role":"recovery-possession","value":"tCnPZHI50-674Hpw3ZTKPdjpTZfcY_D_LyfqBxTjlJP3YfnKIylKRLV_a7uG6afHhUDWhV3UFrSlLFueHzcmBw"},{"algorithm":"Ed25519","key_id":"dm:key:v1:cQhpr9D-av61wTjSZYxTRAij46l3w17pyEOvsmumozc","role":"recovery-possession","value":"ulZmb6s6KCmRfEF9S9kClr35Mp_kSvMZ72ttDpE5EUhu8FTqgdw4i-9YruN9XGRJR8RXTrUTGf2QnMaHDQhvBQ"},{"algorithm":"Ed25519","key_id":"dm:key:v1:r_yqlYEigkMIL_vta_WIeDk-RPW-W2_77UMO7dRoVL4","role":"root-authorization","value":"L_PhReSOjWMVfPNS73KJ1E7UWzn3CVHnDTFncg-o9AVOGoDaLgjtwTMY-z7wEViydF7AFL6LSSoQ9PtVI0D1DA"},{"algorithm":"Ed25519","key_id":"dm:key:v1:zq6BNx7SnY3fYG_z8vq_F0LA-t_oqS14k-7fpd7I2FM","role":"root-authorization","value":"XmIAmXccg1-_r3O2fJrzd_f33qBsas5eegX5ff-1srR5_paGSiCwohn6vIBur0pd8aqaw2HN2PFJlSHPNBB6CA"}]}
