{"artifact_id":"dm:identity:v1:vuurTuqMz055q1Chb_5OQEJoKAI0gd0HFFUQXGws9N4","body":{"being_ref":"dm:being:v1:VlG-k1yMoEXlpk0GvxVCALmpTlFp7GizcHzt3hPcQQs","embodiment_credential_id":"dm:identity:v1:l6qN0-_0UI0yRY7pUhU8XVo3oaTmMkbOCikkVtCo3Xg","embodiment_id":"embodiment:vector:fresh","incarnation_id":"incarnation:vector:fresh:0","incarnation_sequence":0,"started_at_ms":1800000000010},"kind":"incarnation-authorization","schema":"dm.identity.artifact/v1","signatures":[{"algorithm":"Ed25519","key_id":"dm:key:v1:0OmOfxS0ZVgYYsvhhvs8C-WfWG_as6p2JhStrXuDp1w","role":"incarnation-authorization","value":"OtP6_K8saf33HIY3-yetjXmMszdOnmhUkvDttN3i2keaf9k1d99Kx0nMZvysAkV3rKcT-zJiiXbT5152_OIYCg"}]}
