{"artifact_id":"dm:identity:v1:l6qN0-_0UI0yRY7pUhU8XVo3oaTmMkbOCikkVtCo3Xg","body":{"being_ref":"dm:being:v1:VlG-k1yMoEXlpk0GvxVCALmpTlFp7GizcHzt3hPcQQs","body_ref":"cluster:vector:fresh","control_head":"dm:identity:v1:Nca5Hlx-dWYGgzJap1H82V4VJTwKDbGOufJ0_-8-Lys","embodiment_id":"embodiment:vector:fresh","encryption_key":{"algorithm":"X25519","key_id":"dm:key:v1:5jsRNG44ifs6x3Vy0n4rHESzLMARpllQWsW-xh-nviA","public":"TLSTqhPXLM5vOLsOdjZl0p7v7MMSs2-JxB0v2UgAkgI"},"purposes":["dm.we","messages"],"revocation_generation":0,"signing_key":{"algorithm":"Ed25519","key_id":"dm:key:v1:0OmOfxS0ZVgYYsvhhvs8C-WfWG_as6p2JhStrXuDp1w","public":"UxPo49zUNqrHkc75_k0Ssg6rdGdF3WIBF2QW2wTafQ0"},"transport_principals":[{"key":{"algorithm":"Ed25519","key_id":"dm:key:v1:U5pntE0oD-Hm_ag13S7OPtJKyAvHmRt_6yXcp64WJ5A","public":"nwLo-Fuyg40gzlfADeGkVopD3y_yl4m-zwiX__THV0s"},"principal_id":"compaii@vector-fresh","scheme":"dm-peer-v1"}],"valid_from_ms":1800000000010,"valid_until_ms":9007199254740991},"kind":"embodiment-credential","schema":"dm.identity.artifact/v1","signatures":[{"algorithm":"Ed25519","key_id":"dm:key:v1:0OmOfxS0ZVgYYsvhhvs8C-WfWG_as6p2JhStrXuDp1w","role":"embodiment-acceptance","value":"fAApkcOxJqtnYVsQdRqUFoR0wLKXV-3WbEMQz5hl6XnbN-jKGqUEVTbqSg5ifv84RBEhjisAWWScDIJXoY3BBQ"},{"algorithm":"Ed25519","key_id":"dm:key:v1:r_yqlYEigkMIL_vta_WIeDk-RPW-W2_77UMO7dRoVL4","role":"root-authorization","value":"y0t4v_EHLmu79ITd4RJSTbJjgjmQ2ZFL1dsMYmXOn3F7bCgghduKaVKuxLLLvGBTbR3oPTi1A-IQjBHa_gI7Aw"},{"algorithm":"Ed25519","key_id":"dm:key:v1:zq6BNx7SnY3fYG_z8vq_F0LA-t_oqS14k-7fpd7I2FM","role":"root-authorization","value":"2YpMEjCDaKhPrcN7CIeBMF3MffWkqPzgayu-y7k_0KXrQKPHsXVd1vQhNfNYDNf6kU51yTvytgCHwME1Qv2RAg"}]}
