{"artifact_id":"dm:identity:v1:6FzUg3ciNHWVS9ggfDMyAW5jpHmnxl7fEAGA2taQsmY","body":{"being_ref":"dm:being:v1:VlG-k1yMoEXlpk0GvxVCALmpTlFp7GizcHzt3hPcQQs","embodiment_credential_id":"dm:identity:v1:PWGfpIKl4W35tjo7YIzACT4Wnpb49ydFlqdUHs1h8wk","embodiment_id":"embodiment:vector:legion","incarnation_id":"incarnation:vector:legion:0","incarnation_sequence":0,"started_at_ms":1800000000000},"kind":"incarnation-authorization","schema":"dm.identity.artifact/v1","signatures":[{"algorithm":"Ed25519","key_id":"dm:key:v1:WyaJzQtEwQQzExL07i7r0OOAzb3jcq9ZiXVmZgBs6uI","role":"incarnation-authorization","value":"S6YkTX-6BdNO1cGM2z11826aZvbI9wNn7_xW7_TPQWKMg94J7yvCJGKA61aWIC0oN_YNFxuEsjXfP_-dBwhTCw"}]}
