{"artifact_id":"dm:identity:v1:j9_TlnhGobxUQamhnbRjsQ09En4dSq2r6-ALij1fnEI","body":{"being_ref":"dm:being:v1:VlG-k1yMoEXlpk0GvxVCALmpTlFp7GizcHzt3hPcQQs","body_ref":"cluster:vector:recovered","control_head":"dm:identity:v1:rXeE9dar383o7nlzeXS6E2DXQibjnxMppn-0QLHcnm8","embodiment_id":"embodiment:vector:recovered","encryption_key":{"algorithm":"X25519","key_id":"dm:key:v1:IPxMs15TNDqzsKqO-gYZzXetjjnPmteS4-l99hmzMZM","public":"QMkDf51iZPzJYWGQDfus-9mcTlWwfEI6qqduXmlyNVo"},"purposes":["dm.we","messages"],"revocation_generation":0,"signing_key":{"algorithm":"Ed25519","key_id":"dm:key:v1:O6RyYPPDkeYr5vJLftX3WASiis-Fb4x1srcejRzugtQ","public":"L364RhzgW9wo45rwnq58xAhl7kPsp_VCRAk_C_tnp6I"},"transport_principals":[{"key":{"algorithm":"Ed25519","key_id":"dm:key:v1:vQcAZxmRZimCvxbccXsGHy9FPqOJiJ5MfZ56YVZ5p_M","public":"ORF4B-Vp2yLpc5r0EEj3VwUOgNmyJQBOMS0RYNoL4oY"},"principal_id":"compaii@vector-recovered","scheme":"dm-peer-v1"}],"valid_from_ms":1800000000010,"valid_until_ms":9007199254740991},"kind":"embodiment-credential","schema":"dm.identity.artifact/v1","signatures":[{"algorithm":"Ed25519","key_id":"dm:key:v1:O6RyYPPDkeYr5vJLftX3WASiis-Fb4x1srcejRzugtQ","role":"embodiment-acceptance","value":"GX3FxjhlHtRIWyhLPwCpuMn5Gl2eTYZEQxjzkW17s2VHir7pq44h9Ljy9vcCUKHWh5roJFvNzfkBdmth2JDSCg"},{"algorithm":"Ed25519","key_id":"dm:key:v1:P3JLTCEkvQUO6q7m2Of-bwamgueenaIOk61mcHvogFA","role":"root-authorization","value":"e_oTM4qrl4IntKE_kmcB0hgCuypYL35V58KYmBT5YmzC7XU-IsnjQkePHeO6k4QVa8xc7-obNjNtq3KQbXI1Bw"},{"algorithm":"Ed25519","key_id":"dm:key:v1:UKmWc9MZ5tT_HckH3xy1_3ynfyEd9thzCfRU3mB13Ng","role":"root-authorization","value":"rzy35vy7sl-zVdUmDFR_V7hIY3H_bcG4VeuB0VH8KvBVmAry60pRnJ-9OFLYsa5a2ABwErqCL_EJrODdGPzsAA"}]}
