{"artifact_id":"dm:identity:v1:rXeE9dar383o7nlzeXS6E2DXQibjnxMppn-0QLHcnm8","body":{"being_ref":"dm:being:v1:VlG-k1yMoEXlpk0GvxVCALmpTlFp7GizcHzt3hPcQQs","competing_control_heads":["dm:identity:v1:Nca5Hlx-dWYGgzJap1H82V4VJTwKDbGOufJ0_-8-Lys"],"control_generation":1,"control_sequence":0,"replacement_root":{"keys":[{"algorithm":"Ed25519","key_id":"dm:key:v1:P3JLTCEkvQUO6q7m2Of-bwamgueenaIOk61mcHvogFA","public":"kOsCXTr2uQRqxEnk5oH_Lt_CMIMfSBCqvnExoGKkcUA"},{"algorithm":"Ed25519","key_id":"dm:key:v1:UKmWc9MZ5tT_HckH3xy1_3ynfyEd9thzCfRU3mB13Ng","public":"Om9KxhkrWPJrFauq9RAhO_V7v0vZQYSuXn92juy-bOE"}],"threshold":2},"revoked_embodiments":["embodiment:vector:legion"]},"kind":"recovery","schema":"dm.identity.artifact/v1","signatures":[{"algorithm":"Ed25519","key_id":"dm:key:v1:LG5PTtt3Uc0syqP86SwpU_sQ6t6XbLqzBERV0dyiyWU","role":"recovery-authorization","value":"4rjiqmYL27gmexc4H_wVP4DqPgE5B0OqSI7tSDRRXDmOqvj2CdgYNhTs-FdjQgvJ5aAbgXCk_7vQejTp-OZjBQ"},{"algorithm":"Ed25519","key_id":"dm:key:v1:P3JLTCEkvQUO6q7m2Of-bwamgueenaIOk61mcHvogFA","role":"new-root-possession","value":"E9w3Gx9Hx9JzGs7GKS8EBRcRYSsg5Ys9bNF6M4S07klNO3vhCmSG0DTvnuqxiWkPKoI_jQ4ovWFZK7bD8Hz3Ag"},{"algorithm":"Ed25519","key_id":"dm:key:v1:UKmWc9MZ5tT_HckH3xy1_3ynfyEd9thzCfRU3mB13Ng","role":"new-root-possession","value":"TL1HU2-Oazd8XuJGwEHoUhMUXjslFcZEM-AS2aoC_XQaKjrZJVLz8HzE0ELCzG1WTKHbEXqg_9ziag8iJV_aAw"},{"algorithm":"Ed25519","key_id":"dm:key:v1:cQhpr9D-av61wTjSZYxTRAij46l3w17pyEOvsmumozc","role":"recovery-authorization","value":"sbFuGzwuY0cf0n0ifaZ7xnZNCU9aq_-mffq3wSOMHbji3FmSbnjC4kN5SjXtBpP8x1QUL2VnMEmCr2ocx4n_DQ"}]}
